title,link,description,pubDate,title_description
"장애인 직장생활, VR로 돕는다",https://news.naver.com/main/read.naver?mode=LSD&mid=sec&sid1=105&oid=015&aid=0004631398,최신 정보기술(<b>IT</b>)을 ESG(환경·사회·지배구조) 경영에 접목한 사례다. 22일 관련 업계에 따르면 KT는 경기... 장애인 <b>취업</b>률이 높은 직종 중심으로 콘텐츠 제작을 늘릴 계획이다. 넷마블은 작년 넷마블문화재단을 통해... ,"Mon, 22 Nov 2021 17:04:00 +0900","장애인 직장생활, VR로 돕는다 최신 정보기술(<b>IT</b>)을 ESG(환경·사회·지배구조) 경영에 접목한 사례다. 22일 관련 업계에 따르면 KT는 경기... 장애인 <b>취업</b>률이 높은 직종 중심으로 콘텐츠 제작을 늘릴 계획이다. 넷마블은 작년 넷마블문화재단을 통해... "
"마포구, 청년 취‧창업 맞춤형 정책 펼쳐",https://www.siminilbo.co.kr/news/newsview.php?ncode=1160286217925427,"지난 6~14일 구는 지역의 <b>IT</b>‧스타트업계 기업과 청년 인재가 겪고 있는 일자리 매칭 문제를 해결하고자 국내... 101명이 <b>취업</b>에 성공한 것으로 집계됐으며, 이 중 20대가 35%로 가장 많은 비중을 차지한 것으로 드러났다.... ","Mon, 22 Nov 2021 16:52:00 +0900","마포구, 청년 취‧창업 맞춤형 정책 펼쳐 지난 6~14일 구는 지역의 <b>IT</b>‧스타트업계 기업과 청년 인재가 겪고 있는 일자리 매칭 문제를 해결하고자 국내... 101명이 <b>취업</b>에 성공한 것으로 집계됐으며, 이 중 20대가 35%로 가장 많은 비중을 차지한 것으로 드러났다.... "
금오공대,http://www.hidomin.com/news/articleView.html?idxno=469137,"학생처장, <b>취업</b>지원본부장 겸무 이용환(전자공학부), 기획협력처장 이현권(신소재공학부), 입학본부장... 김영형(<b>IT</b>융합학과), 교수학습개발센터장 안동준(건축학부), 중소기업산학협력센터장, 구미산업기술정보센터장... ","Mon, 22 Nov 2021 16:50:00 +0900","금오공대 학생처장, <b>취업</b>지원본부장 겸무 이용환(전자공학부), 기획협력처장 이현권(신소재공학부), 입학본부장... 김영형(<b>IT</b>융합학과), 교수학습개발센터장 안동준(건축학부), 중소기업산학협력센터장, 구미산업기술정보센터장... "
"에듀윌, 전산세무회계 혜택 지원 '0원 합격반' 강좌 운영",http://www.kdfnews.com/news/articleView.html?idxno=83193,"과목별 출제 포인트 복습 '파이널특강', 최신 기출해설특강 등으로 전산세무회계 실전 대비를 돕는다. 특히 <b>취업</b> 준비생을 위해 AT핵심기출특강, <b>IT</b>자격증 5종 전 강좌, NCS패키지 등이 마련됐다. 사진 에듀윌","Mon, 22 Nov 2021 16:46:00 +0900","에듀윌, 전산세무회계 혜택 지원 '0원 합격반' 강좌 운영 과목별 출제 포인트 복습 '파이널특강', 최신 기출해설특강 등으로 전산세무회계 실전 대비를 돕는다. 특히 <b>취업</b> 준비생을 위해 AT핵심기출특강, <b>IT</b>자격증 5종 전 강좌, NCS패키지 등이 마련됐다. 사진 에듀윌"
[인사] 금오공대,http://www.kyongbuk.co.kr/news/articleView.html?idxno=2088149,(기계설계공학과) △학생처장·<b>취업</b>지원본부장 이용환(전자공학부) △기획협력처장 이현권(신소재공학부)... 김영형(<b>IT</b>융합학과) △교수학습개발센터장 안동준(건축학부) △중소기업산학협력센터장... ,"Mon, 22 Nov 2021 16:36:00 +0900",[인사] 금오공대 (기계설계공학과) △학생처장·<b>취업</b>지원본부장 이용환(전자공학부) △기획협력처장 이현권(신소재공학부)... 김영형(<b>IT</b>융합학과) △교수학습개발센터장 안동준(건축학부) △중소기업산학협력센터장... 
"코드스테이츠, SW 개발자 부트캠프 37기 훈련생 모집",https://news.naver.com/main/read.naver?mode=LSD&mid=sec&sid1=105&oid=092&aid=0002239874,"지원하는 <b>IT</b> 커리어 전환 코스다. 특히 이번 기수는 초기 비용 부담을 덜어주는 위-윈(We Win) 프로그램의 2021년 마지막 소프트웨어 엔지니어링 교육과정이다. 위-윈은 별도 비용 부담 없이 교육을 먼저 이수한 후, <b>취업</b>을... ","Mon, 22 Nov 2021 16:23:00 +0900","코드스테이츠, SW 개발자 부트캠프 37기 훈련생 모집 지원하는 <b>IT</b> 커리어 전환 코스다. 특히 이번 기수는 초기 비용 부담을 덜어주는 위-윈(We Win) 프로그램의 2021년 마지막 소프트웨어 엔지니어링 교육과정이다. 위-윈은 별도 비용 부담 없이 교육을 먼저 이수한 후, <b>취업</b>을... "
"마포구, 청년 위해 팔 걷는다",http://www.job-post.co.kr/news/articleView.html?idxno=41909,"먼저, 구는 지역의 <b>IT</b>‧스타트업계 기업과 청년 인재가 겪고 있는 일자리 매칭 문제를 해결하고자 지난... 구인기업 112개, 구인인원 460여 명이 참여했던 박람회에서는 기존 현장 박람회 대비 약 10배 많은 101명이 <b>취업</b>에... ","Mon, 22 Nov 2021 16:20:00 +0900","마포구, 청년 위해 팔 걷는다 먼저, 구는 지역의 <b>IT</b>‧스타트업계 기업과 청년 인재가 겪고 있는 일자리 매칭 문제를 해결하고자 지난... 구인기업 112개, 구인인원 460여 명이 참여했던 박람회에서는 기존 현장 박람회 대비 약 10배 많은 101명이 <b>취업</b>에... "
"중앙대학교 미래교육원, 정시 4·5·6등급 대학 수험생 입학상담 진행",http://www.job-post.co.kr/news/articleView.html?idxno=41911,"빅데이터 분석 등 다양한 응용분야를 학습해 창의적인 <b>IT</b>전문가 양성을 목표로 한다. 체육학과정에서는... 학사 학력으로 학사편입, 대학원, <b>취업</b> 등의 진로로 연계된다. 중앙대학교 미래교육원은 고3수험생... ","Mon, 22 Nov 2021 16:16:00 +0900","중앙대학교 미래교육원, 정시 4·5·6등급 대학 수험생 입학상담 진행 빅데이터 분석 등 다양한 응용분야를 학습해 창의적인 <b>IT</b>전문가 양성을 목표로 한다. 체육학과정에서는... 학사 학력으로 학사편입, 대학원, <b>취업</b> 등의 진로로 연계된다. 중앙대학교 미래교육원은 고3수험생... "
"국비지원 컴퓨터학원 더조은아카데미, ‘2021 경기도 라이센스 페어’에서 자...",http://edu.donga.com/?p=article&ps=view&at_no=20211122154132876228,주최로 <b>취업</b>박람회와 잡페어 등 다양한 행사들이 개최되고 있다. 이런 가운데 국비지원 컴퓨터학원 ‘더조은컴퓨터아카데미 강남캠퍼스’와 ‘더조은<b>IT</b>아카데미 종각캠퍼스’가 ‘2021 경기도 라이센스 페어’에... ,"Mon, 22 Nov 2021 15:42:00 +0900","국비지원 컴퓨터학원 더조은아카데미, ‘2021 경기도 라이센스 페어’에서 자... 주최로 <b>취업</b>박람회와 잡페어 등 다양한 행사들이 개최되고 있다. 이런 가운데 국비지원 컴퓨터학원 ‘더조은컴퓨터아카데미 강남캠퍼스’와 ‘더조은<b>IT</b>아카데미 종각캠퍼스’가 ‘2021 경기도 라이센스 페어’에... "
"수원시, 청년일자리 창출 위해 두팔 걷어",http://www.enewstoday.co.kr/news/articleView.html?idxno=1528500,<b>취업</b> 운영위원회는 수원시 공직자를 비롯한 산업·교육·창업·<b>IT</b> 분야 전문가 등 8명으로 구성됐다. 오는 12월까지 3개월간 ▲취·창업 심층 면접 및 분석을 통한 1:1 밀착 멘토링 ▲일자리 발굴단 운영 ▲<b>취업</b>... ,"Mon, 22 Nov 2021 15:32:00 +0900","수원시, 청년일자리 창출 위해 두팔 걷어 <b>취업</b> 운영위원회는 수원시 공직자를 비롯한 산업·교육·창업·<b>IT</b> 분야 전문가 등 8명으로 구성됐다. 오는 12월까지 3개월간 ▲취·창업 심층 면접 및 분석을 통한 1:1 밀착 멘토링 ▲일자리 발굴단 운영 ▲<b>취업</b>... "
"디지털 뉴노멀의 미래, '소프트웨이브 2021' 개최",http://www.enewstoday.co.kr/news/articleView.html?idxno=1528411,'소프트웨이브 2021' 전시회는 패키지SW/<b>IT</b>서비스/융합SW/인터넷SW/게임콘텐츠SW까지 5개 전시 분야로 나뉘어... 진로·<b>취업</b>전략도 일반 참관객들에게 소개된다. 행사장에서는 정부의 단계적 일상회복 정책 및 세부지침에... ,"Mon, 22 Nov 2021 15:15:00 +0900","디지털 뉴노멀의 미래, '소프트웨이브 2021' 개최 '소프트웨이브 2021' 전시회는 패키지SW/<b>IT</b>서비스/융합SW/인터넷SW/게임콘텐츠SW까지 5개 전시 분야로 나뉘어... 진로·<b>취업</b>전략도 일반 참관객들에게 소개된다. 행사장에서는 정부의 단계적 일상회복 정책 및 세부지침에... "
"설민석의 단꿈자격증, 컴퓨터활용능력 런칭으로 <b>취업</b> 필수 스펙 완성",http://edu.donga.com/?p=article&ps=view&at_no=20211122151259436122,"단꿈자격증은 기존 한국사능력검정시험, KBS 한국어능력시험, 실용글쓰기와 같은 인문 과정에 이어 <b>IT</b> 자격증인 컴퓨터활용능력 과정까지 런칭하며 ‘<b>취업</b> 필수 스펙 과정’을 완성했다. 이로써 수험생들은... ","Mon, 22 Nov 2021 15:14:00 +0900","설민석의 단꿈자격증, 컴퓨터활용능력 런칭으로 <b>취업</b> 필수 스펙 완성 단꿈자격증은 기존 한국사능력검정시험, KBS 한국어능력시험, 실용글쓰기와 같은 인문 과정에 이어 <b>IT</b> 자격증인 컴퓨터활용능력 과정까지 런칭하며 ‘<b>취업</b> 필수 스펙 과정’을 완성했다. 이로써 수험생들은... "
"[증권소식] 미래에셋증권, WM부문 조직개편/&quot;MZ세대 선호 미래 재테크는 부동...",https://www.asiatime.co.kr/article/20211122500225,증시와 <b>IT</b> 산업을 전망하고 투자 전략을 소개하는 ‘증시와 <b>IT</b>산업 전망 라이브 세미나’를 진행한다고... 청년 <b>취업</b>의 어려움과 더불어 최근 부동산 급등에 따른 MZ세대의 허탈감이 반영된 것으로 분석된다. 뒤를... ,"Mon, 22 Nov 2021 15:00:00 +0900","[증권소식] 미래에셋증권, WM부문 조직개편/&quot;MZ세대 선호 미래 재테크는 부동... 증시와 <b>IT</b> 산업을 전망하고 투자 전략을 소개하는 ‘증시와 <b>IT</b>산업 전망 라이브 세미나’를 진행한다고... 청년 <b>취업</b>의 어려움과 더불어 최근 부동산 급등에 따른 MZ세대의 허탈감이 반영된 것으로 분석된다. 뒤를... "
[인사] 금오공대,http://www.veritas-a.com/news/articleView.html?idxno=397940,"겸무▲학생처장, <b>취업</b>지원본부장 이용환(전자공학부) 겸무 ▲기획협력처장 이현권(신소재공학부)... 김영형(<b>IT</b>융합학과) ▲교수학습개발센터장 안동준(건축학부) ▲중소기업산학협력센터장, 구미산업기술정보센터장... ","Mon, 22 Nov 2021 14:54:00 +0900","[인사] 금오공대 겸무▲학생처장, <b>취업</b>지원본부장 이용환(전자공학부) 겸무 ▲기획협력처장 이현권(신소재공학부)... 김영형(<b>IT</b>융합학과) ▲교수학습개발센터장 안동준(건축학부) ▲중소기업산학협력센터장, 구미산업기술정보센터장... "
"'일자리' 찾는 김총리, 정의선에 폴더 인사…&quot;기업만 비트냐 오해도&quot;",https://news.naver.com/main/read.naver?mode=LSD&mid=sec&sid1=100&oid=421&aid=0005739623,"정 회장은 &quot;청년들이 많이 <b>취업</b>하고, 회사 내부에서도 많은 부분이 로테이션이 되면서 선순환돼서 회사... 총리실은 향후 청년들의 선호도가 높은 플랫폼·<b>IT</b>(정보통신) 분야 직종을 중심으로 '청년희망ON 프로젝트... ","Mon, 22 Nov 2021 14:43:00 +0900","'일자리' 찾는 김총리, 정의선에 폴더 인사…&quot;기업만 비트냐 오해도&quot; 정 회장은 &quot;청년들이 많이 <b>취업</b>하고, 회사 내부에서도 많은 부분이 로테이션이 되면서 선순환돼서 회사... 총리실은 향후 청년들의 선호도가 높은 플랫폼·<b>IT</b>(정보통신) 분야 직종을 중심으로 '청년희망ON 프로젝트... "
[CEO 캐릭터 리뷰_증권사 편⑫] 한화투자증권 권희백 대표이사 &quot;정통 한화맨 ...,http://www.newsworker.co.kr/news/articleView.html?idxno=136511,이와 더불어 이번 사건을 계기로 <b>IT</b> 관련 인프라를 확충하겠다고 밝혔다. 또 청약 환불금이 지급되는 2021년... 금융권 <b>취업</b>을 준비하는 특성화고 학생들에게 맞춰 '금융 멘토링'을 지원한다. '금융 멘토링'은 경제·금융... ,"Mon, 22 Nov 2021 14:36:00 +0900",[CEO 캐릭터 리뷰_증권사 편⑫] 한화투자증권 권희백 대표이사 &quot;정통 한화맨 ... 이와 더불어 이번 사건을 계기로 <b>IT</b> 관련 인프라를 확충하겠다고 밝혔다. 또 청약 환불금이 지급되는 2021년... 금융권 <b>취업</b>을 준비하는 특성화고 학생들에게 맞춰 '금융 멘토링'을 지원한다. '금융 멘토링'은 경제·금융... 
삼성·현대차 등 6개 그룹서 약속한 청년일자리 '3년간 17만9000개',http://www.newspim.com/news/view/20211122000771,"반도체를 비롯해 바이오, 정보통신(<b>IT</b>), 배터리 등 SK가 주도하고 있는 첨단 산업 분야의 일자리 창출로 그룹의 미래 성장을 가속하겠다는 전략이다. 아울러 SK그룹은 ▲<b>취업</b>에 어려움을 겪고 있는 청년을 대상으로... ","Mon, 22 Nov 2021 14:33:00 +0900","삼성·현대차 등 6개 그룹서 약속한 청년일자리 '3년간 17만9000개' 반도체를 비롯해 바이오, 정보통신(<b>IT</b>), 배터리 등 SK가 주도하고 있는 첨단 산업 분야의 일자리 창출로 그룹의 미래 성장을 가속하겠다는 전략이다. 아울러 SK그룹은 ▲<b>취업</b>에 어려움을 겪고 있는 청년을 대상으로... "
[인사] 금오공대,https://daily.hankooki.com/lpage/society/202111/dh20211122142724148520.htm?s_ref=nv,"겸무 ▲학생처장, <b>취업</b>지원본부장 이용환(전자공학부) 겸무 ▲기획협력처장 이현권(신소재공학부)... 김영형(<b>IT</b>융합학과) ▲교수학습개발센터장 안동준(건축학부) ▲중소기업산학협력센터장, 구미산업기술정보센터장... ","Mon, 22 Nov 2021 14:32:00 +0900","[인사] 금오공대 겸무 ▲학생처장, <b>취업</b>지원본부장 이용환(전자공학부) 겸무 ▲기획협력처장 이현권(신소재공학부)... 김영형(<b>IT</b>융합학과) ▲교수학습개발센터장 안동준(건축학부) ▲중소기업산학협력센터장, 구미산업기술정보센터장... "
정의선 회장 &quot;3년간 청년 일자리 4.6만개 약속&quot;,http://www.sporbiz.co.kr/news/articleView.html?idxno=602829,청년들의 <b>취업</b> 교육 기회를 더 늘릴 수 있도록 하고 '청년 기술창업 활성화 방안'도 수립해 발표할 예정이다. 아울러 김 총리는 향후 청년들이 취직을 희망하는 플랫폼 기업이나 <b>IT</b> 기업을 중심으로 '청년희망ON... ,"Mon, 22 Nov 2021 14:26:00 +0900",정의선 회장 &quot;3년간 청년 일자리 4.6만개 약속&quot; 청년들의 <b>취업</b> 교육 기회를 더 늘릴 수 있도록 하고 '청년 기술창업 활성화 방안'도 수립해 발표할 예정이다. 아울러 김 총리는 향후 청년들이 취직을 희망하는 플랫폼 기업이나 <b>IT</b> 기업을 중심으로 '청년희망ON... 
과천시 청년복합공간 ‘비행지구’ 개소식 열려,http://www.breaknews.com/849809,"물론이고, <b>취업</b>, 연애, 결혼, 공부 등의 분야에 대해 인생 선배로서의 조언도 함께... Anyone between the ages of 19 and 39 can use <b>it</b>. At the event, Gwacheon Mayor Kim Jong-cheon and young people... ","Mon, 22 Nov 2021 14:26:00 +0900","과천시 청년복합공간 ‘비행지구’ 개소식 열려 물론이고, <b>취업</b>, 연애, 결혼, 공부 등의 분야에 대해 인생 선배로서의 조언도 함께... Anyone between the ages of 19 and 39 can use <b>it</b>. At the event, Gwacheon Mayor Kim Jong-cheon and young people... "
"수원시, 메타버스 시장 선도 ‘디지털 인재’ <b>취업</b> 지원",https://news.naver.com/main/read.naver?mode=LSD&mid=sec&sid1=102&oid=003&aid=0010846820,<b>취업</b> 운영위원회는 시 공직자를 비롯한 산업·교육·창업·<b>IT</b> 분야 전문가 등 8명으로 구성됐다. 오는 12월까지 3개월간 ▲취·창업 심층 면접 및 분석을 통한 1:1 밀착 멘토링 ▲일자리 발굴단 운영 ▲<b>취업</b> 운영위원회... ,"Mon, 22 Nov 2021 14:23:00 +0900","수원시, 메타버스 시장 선도 ‘디지털 인재’ <b>취업</b> 지원 <b>취업</b> 운영위원회는 시 공직자를 비롯한 산업·교육·창업·<b>IT</b> 분야 전문가 등 8명으로 구성됐다. 오는 12월까지 3개월간 ▲취·창업 심층 면접 및 분석을 통한 1:1 밀착 멘토링 ▲일자리 발굴단 운영 ▲<b>취업</b> 운영위원회... "
한국<b>IT</b>직업전문학교 AI학과 수능 후 2022학년도 신입생 모집,http://www.job-post.co.kr/news/articleView.html?idxno=41885," 수능 후 수험생들의 심리적 불안감이 커지고 있는 가운데, 수능 성적과 내신 성적이 무관한 한국<b>IT</b>직업전... 등 <b>취업</b>이 연계되고 개인의 경쟁력을 강화할 수 있는 학과들에 수험생들이 주목하고 있다&quot;고 말했다.... ","Mon, 22 Nov 2021 14:12:00 +0900","한국<b>IT</b>직업전문학교 AI학과 수능 후 2022학년도 신입생 모집  수능 후 수험생들의 심리적 불안감이 커지고 있는 가운데, 수능 성적과 내신 성적이 무관한 한국<b>IT</b>직업전... 등 <b>취업</b>이 연계되고 개인의 경쟁력을 강화할 수 있는 학과들에 수험생들이 주목하고 있다&quot;고 말했다.... "
"수원시, 전자상거래 전문인력 양성 '청년 <b>취업</b>' 돕는다",https://news.naver.com/main/read.naver?mode=LSD&mid=sec&sid1=102&oid=629&aid=0000117372,<b>취업</b> 운영위원회는 수원시 공직자를 비롯한 산업·교육·창업·<b>IT</b> 분야 전문가 등 8명으로 구성돼 있다. 위원회는 다음달까지 3개월 동안 취·창업 심층 면접 및 분석을 통한 1대 1 밀착 멘토링 일자리 발굴단 운영 <b>취업</b>... ,"Mon, 22 Nov 2021 14:08:00 +0900","수원시, 전자상거래 전문인력 양성 '청년 <b>취업</b>' 돕는다 <b>취업</b> 운영위원회는 수원시 공직자를 비롯한 산업·교육·창업·<b>IT</b> 분야 전문가 등 8명으로 구성돼 있다. 위원회는 다음달까지 3개월 동안 취·창업 심층 면접 및 분석을 통한 1대 1 밀착 멘토링 일자리 발굴단 운영 <b>취업</b>... "
일자리 '공정성'은 어떻게 확보하는가..연구포럼 개최,http://www.newsfarm.co.kr/news/articleView.html?idxno=72845,"'무민'은 한자 없을 무에 의미하다는 뜻의 영어단어 민(mean)을 합친 신조어로 <b>취업</b>, 직장 등 치열한 현실에... 또 AI 인재 100만명 양성 프로젝트 추진, AI, DATA 등 신기술분야 인재양성 대학교 <b>IT</b>학과 정원확대를 추진해... ","Mon, 22 Nov 2021 14:02:00 +0900","일자리 '공정성'은 어떻게 확보하는가..연구포럼 개최 '무민'은 한자 없을 무에 의미하다는 뜻의 영어단어 민(mean)을 합친 신조어로 <b>취업</b>, 직장 등 치열한 현실에... 또 AI 인재 100만명 양성 프로젝트 추진, AI, DATA 등 신기술분야 인재양성 대학교 <b>IT</b>학과 정원확대를 추진해... "
"코드스테이츠, 소프트웨어 엔지니어링 부트캠프 37기 모집",http://www.epnc.co.kr/news/articleView.html?idxno=217049,"후, <b>취업</b>을 했을 때 연봉의 일정 비율을 교육비로 후 지불할 수 있도록 지원하는 코드스테이츠만의 특별 교육 프로그램이다. 37기 모집 인원은 총 100명 규모로, 전공이나 경력과 관계없이 <b>IT</b> 커리어 전환을 희망하는... ","Mon, 22 Nov 2021 13:54:00 +0900","코드스테이츠, 소프트웨어 엔지니어링 부트캠프 37기 모집 후, <b>취업</b>을 했을 때 연봉의 일정 비율을 교육비로 후 지불할 수 있도록 지원하는 코드스테이츠만의 특별 교육 프로그램이다. 37기 모집 인원은 총 100명 규모로, 전공이나 경력과 관계없이 <b>IT</b> 커리어 전환을 희망하는... "
"현대차, 일자리 4.6만개 창출 약속… 미래산업 채용 확대",http://www.segyebiz.com/newsView/20211122508980?OutUrl=naver,총리실은 ‘청년희망ON’ 참여 기업들과 정부 간 소통 창구를 마련해 청년들의 <b>취업</b> 교육 기회를 더 늘릴 수 있도록 하고 청년 기술창업 활성화 방안도 수립해 발표할 예정이다. 이후 플랫폼 기업이나 <b>IT</b>(정보통신)... ,"Mon, 22 Nov 2021 13:42:00 +0900","현대차, 일자리 4.6만개 창출 약속… 미래산업 채용 확대 총리실은 ‘청년희망ON’ 참여 기업들과 정부 간 소통 창구를 마련해 청년들의 <b>취업</b> 교육 기회를 더 늘릴 수 있도록 하고 청년 기술창업 활성화 방안도 수립해 발표할 예정이다. 이후 플랫폼 기업이나 <b>IT</b>(정보통신)... "
MZ세대가 가장 선호하는 재테크 수단은 '부동산',http://www.koreaittimes.com/news/articleView.html?idxno=109591,전경련은 &quot;청년 <b>취업</b>의 어려움과 더불어 최근 부동산 급등에 따른 MZ세대의 허탈감이 나타난 것&quot;이라고... 조성해야 한다&quot;고 강조했다. By 김세화 (코리아아이티타임즈/코리아<b>IT</b>타임스/koreaittimes/ittimes/Korea <b>IT</b> Times),"Mon, 22 Nov 2021 13:36:00 +0900",MZ세대가 가장 선호하는 재테크 수단은 '부동산' 전경련은 &quot;청년 <b>취업</b>의 어려움과 더불어 최근 부동산 급등에 따른 MZ세대의 허탈감이 나타난 것&quot;이라고... 조성해야 한다&quot;고 강조했다. By 김세화 (코리아아이티타임즈/코리아<b>IT</b>타임스/koreaittimes/ittimes/Korea <b>IT</b> Times)
수원시 메타버스 시장 선도하는‘디지털 인재’<b>취업</b> 돕는다,http://www.beyondpost.co.kr/view.php?ud=20211122133247420812e1c49aa6_30,<b>취업</b> 운영위원회는 수원시 공직자를 비롯한 산업·교육·창업·<b>IT</b> 분야 전문가 등 8명으로 구성됐다. 오는 12월까지 3개월간 ▲취·창업 심층 면접 및 분석을 통한 1:1 밀착 멘토링 ▲일자리 발굴단 운영 ▲<b>취업</b> 운영위원회... ,"Mon, 22 Nov 2021 13:36:00 +0900",수원시 메타버스 시장 선도하는‘디지털 인재’<b>취업</b> 돕는다 <b>취업</b> 운영위원회는 수원시 공직자를 비롯한 산업·교육·창업·<b>IT</b> 분야 전문가 등 8명으로 구성됐다. 오는 12월까지 3개월간 ▲취·창업 심층 면접 및 분석을 통한 1:1 밀착 멘토링 ▲일자리 발굴단 운영 ▲<b>취업</b> 운영위원회... 
"수원시, 메타버스 시장 선도하는 '디지털 인재' <b>취업</b> 돕는다",https://news.naver.com/main/read.naver?mode=LSD&mid=sec&sid1=102&oid=417&aid=0000756854,<b>취업</b> 운영위원회는 수원시 공직자를 비롯한 산업·교육·창업·<b>IT</b> 분야 전문가 등 8명으로 구성됐다. 오는 12월까지 3개월간 ▲취·창업 심층 면접 및 분석을 통한 1:1 밀착 멘토링 ▲일자리 발굴단 운영 ▲<b>취업</b> 운영위원회... ,"Mon, 22 Nov 2021 13:29:00 +0900","수원시, 메타버스 시장 선도하는 '디지털 인재' <b>취업</b> 돕는다 <b>취업</b> 운영위원회는 수원시 공직자를 비롯한 산업·교육·창업·<b>IT</b> 분야 전문가 등 8명으로 구성됐다. 오는 12월까지 3개월간 ▲취·창업 심층 면접 및 분석을 통한 1:1 밀착 멘토링 ▲일자리 발굴단 운영 ▲<b>취업</b> 운영위원회... "
"코드스테이츠, 소프트웨어 엔지니어링 부트캠프 37기 모집",http://www.datanet.co.kr/news/articleView.html?idxno=166771,"후, <b>취업</b>을 했을 때 연봉의 일정 비율을 교육비로 후 지불할 수 있도록 지원하는 코드스테이츠만의 특별 교육 프로그램이다. 37기 모집 인원은 총 100명 규모로, 전공이나 경력과 관계없이 <b>IT</b> 커리어 전환을 원하는... ","Mon, 22 Nov 2021 12:56:00 +0900","코드스테이츠, 소프트웨어 엔지니어링 부트캠프 37기 모집 후, <b>취업</b>을 했을 때 연봉의 일정 비율을 교육비로 후 지불할 수 있도록 지원하는 코드스테이츠만의 특별 교육 프로그램이다. 37기 모집 인원은 총 100명 규모로, 전공이나 경력과 관계없이 <b>IT</b> 커리어 전환을 원하는... "
