title,link,description,pubDate,title_description
"NS홈쇼핑, 2022년 신입사원 공개채용",http://www.cooknchefnews.com/news/newsview.php?ncode=1065599260780040,"채용 직무는 PD, MD, <b>IT</b>, 서비스기획, 방송심의 부문이며, 지원대상은 2022년 2월 졸업예정자 및 기... NS홈쇼핑 인사팀 박재순 팀장은 “어려운 시국이지만 <b>취업</b>준비생들을 직접 만나 혼자 준비하느라 힘들었을... ","Wed, 17 Nov 2021 16:52:00 +0900","NS홈쇼핑, 2022년 신입사원 공개채용 채용 직무는 PD, MD, <b>IT</b>, 서비스기획, 방송심의 부문이며, 지원대상은 2022년 2월 졸업예정자 및 기... NS홈쇼핑 인사팀 박재순 팀장은 “어려운 시국이지만 <b>취업</b>준비생들을 직접 만나 혼자 준비하느라 힘들었을... "
"쿠팡, 육군 인사사령부와 전역장병 <b>취업</b>지원 MOU 체결",http://www.gokorea.kr/news/articleView.html?idxno=715519,"쿠팡 제공 쿠팡이 육군 인사사령부와 손잡고 전역 예정 장병 <b>취업</b>지원에 나선다. 쿠팡은 육군 인사사령부와... 안전관리직, <b>IT</b>보안직 등 현재 쿠팡이 모집하고 있는 채용 분야에 적합한 인재를 추천한다는 방침이다. 고... ","Wed, 17 Nov 2021 16:44:00 +0900","쿠팡, 육군 인사사령부와 전역장병 <b>취업</b>지원 MOU 체결 쿠팡 제공 쿠팡이 육군 인사사령부와 손잡고 전역 예정 장병 <b>취업</b>지원에 나선다. 쿠팡은 육군 인사사령부와... 안전관리직, <b>IT</b>보안직 등 현재 쿠팡이 모집하고 있는 채용 분야에 적합한 인재를 추천한다는 방침이다. 고... "
"한밭대, '2021 HBNU 언택트 직무원정대'",http://www.goodmorningcc.com/news/articleView.html?idxno=260269,"기반으로 <b>취업</b> 전략을 수립할 수 있도록 '2021 HBNU 언택트 직무원정대' 프로그램을 이달 26일까지 비대면... 특강은 학생들의 관심이 높은 경영지원, <b>IT</b> 개발, 연구·설계, 생산·품질 등 총 10개의 분야로 구성됐으며, 매일... ","Wed, 17 Nov 2021 16:24:00 +0900","한밭대, '2021 HBNU 언택트 직무원정대' 기반으로 <b>취업</b> 전략을 수립할 수 있도록 '2021 HBNU 언택트 직무원정대' 프로그램을 이달 26일까지 비대면... 특강은 학생들의 관심이 높은 경영지원, <b>IT</b> 개발, 연구·설계, 생산·품질 등 총 10개의 분야로 구성됐으며, 매일... "
"쿠팡-육군 인사사령부, 전역장병 <b>취업</b>지원 MOU 맺어",http://www.gvalley.co.kr/news/articleView.html?idxno=583548,"장병들의 <b>취업</b> 지원에 지속적으로 힘쓸 것을 약속했다. 인사사령부는 장병들에게 정보통신기술(ICT) 분야의 기술 학습 환경을 조성하고, FC 운영관리직, 배송직(쿠팡친구), 안전관리직, <b>IT</b>보안직 등 현재 쿠팡이 모집하고... ","Wed, 17 Nov 2021 16:22:00 +0900","쿠팡-육군 인사사령부, 전역장병 <b>취업</b>지원 MOU 맺어 장병들의 <b>취업</b> 지원에 지속적으로 힘쓸 것을 약속했다. 인사사령부는 장병들에게 정보통신기술(ICT) 분야의 기술 학습 환경을 조성하고, FC 운영관리직, 배송직(쿠팡친구), 안전관리직, <b>IT</b>보안직 등 현재 쿠팡이 모집하고... "
"쿠팡, 육군 인사사령부와 전역 장병 <b>취업</b>지원 MOU 체결",http://www.koreastocknews.com/news/articleView.html?idxno=68200,"쿠팡은 17일 육군 인사사령부와 함께 육군본부 계룡대에서 전역을 앞둔 장병들의 <b>취업</b>지원과... 안전관리직, <b>IT</b>보안직 등 현재 쿠팡이 모집하고 있는 채용 분야에 적합한 우수인재를 적극적으로 추천할 예정이다.... ","Wed, 17 Nov 2021 16:18:00 +0900","쿠팡, 육군 인사사령부와 전역 장병 <b>취업</b>지원 MOU 체결 쿠팡은 17일 육군 인사사령부와 함께 육군본부 계룡대에서 전역을 앞둔 장병들의 <b>취업</b>지원과... 안전관리직, <b>IT</b>보안직 등 현재 쿠팡이 모집하고 있는 채용 분야에 적합한 우수인재를 적극적으로 추천할 예정이다.... "
"쿠팡, 군 전역 장병 채용 확대…육군 인사사령부와 협약",http://www.4th.kr/news/articleView.html?idxno=2008800,"장병들의 <b>취업</b>지원과 정보통신기술(ICT) 인재양성을 위한 협약을 체결했다. (왼쪽부터) 김명규 쿠팡 전무와... 안전관리직, <b>IT</b>보안직 등 현재 쿠팡이 모집하고 있는 채용 분야에 적합한 우수인재를 적극적으로 추천할... ","Wed, 17 Nov 2021 16:16:00 +0900","쿠팡, 군 전역 장병 채용 확대…육군 인사사령부와 협약 장병들의 <b>취업</b>지원과 정보통신기술(ICT) 인재양성을 위한 협약을 체결했다. (왼쪽부터) 김명규 쿠팡 전무와... 안전관리직, <b>IT</b>보안직 등 현재 쿠팡이 모집하고 있는 채용 분야에 적합한 우수인재를 적극적으로 추천할... "
"쿠팡, 육군 인사사령부와 전역장병 <b>취업</b>지원 MOU 체결",http://www.worktoday.co.kr/news/articleView.html?idxno=20004,"쿠팡은 17일 육군 인사사령부와 함께 육군본부 계룡대에서 전역을 앞둔 장병들의 <b>취업</b>지원과 정보통신기술... 안전관리직, <b>IT</b>보안직 등 현재 쿠팡이 모집하고 있는 채용 분야에 적합한 우수인재를 적극적으로 추천할... ","Wed, 17 Nov 2021 16:16:00 +0900","쿠팡, 육군 인사사령부와 전역장병 <b>취업</b>지원 MOU 체결 쿠팡은 17일 육군 인사사령부와 함께 육군본부 계룡대에서 전역을 앞둔 장병들의 <b>취업</b>지원과 정보통신기술... 안전관리직, <b>IT</b>보안직 등 현재 쿠팡이 모집하고 있는 채용 분야에 적합한 우수인재를 적극적으로 추천할... "
"한밭대, '2021 HBNU 언택트 직무원정대' 운영",http://www.newstnt.com/news/articleView.html?idxno=114509,"학생들의 관심이 높은 경영지원, <b>IT</b>개발, 연구·설계, 생산·품질 등 총 10개의 분야로 구성했으며 매일 저녁... 역량과 <b>취업</b>노하우가 전해질 예정이다. 한밭대 대학일자리본부 박정호 본부장은 &quot;한밭대 학생들과 지역... ","Wed, 17 Nov 2021 16:12:00 +0900","한밭대, '2021 HBNU 언택트 직무원정대' 운영 학생들의 관심이 높은 경영지원, <b>IT</b>개발, 연구·설계, 생산·품질 등 총 10개의 분야로 구성했으며 매일 저녁... 역량과 <b>취업</b>노하우가 전해질 예정이다. 한밭대 대학일자리본부 박정호 본부장은 &quot;한밭대 학생들과 지역... "
[디지털 인력양성 정책방안 지상좌담회] &quot;기업과 교육기관 시각차 존재…실질...,https://news.naver.com/main/read.naver?mode=LSD&mid=sec&sid1=105&oid=030&aid=0002982595,"SW 개발자를 비롯해 정보기술(<b>IT</b>) 인력 부족 현상은 어제오늘 일이 아니지만, 정책적으로 겉돈다. 기업이... 나머지 기업과 대학 졸업생은 여전히 구직과 <b>취업</b>에 힘들다. ◇이경배=주 52시간 근무제로 인력난이 심화됐다.... ","Wed, 17 Nov 2021 16:02:00 +0900","[디지털 인력양성 정책방안 지상좌담회] &quot;기업과 교육기관 시각차 존재…실질... SW 개발자를 비롯해 정보기술(<b>IT</b>) 인력 부족 현상은 어제오늘 일이 아니지만, 정책적으로 겉돈다. 기업이... 나머지 기업과 대학 졸업생은 여전히 구직과 <b>취업</b>에 힘들다. ◇이경배=주 52시간 근무제로 인력난이 심화됐다.... "
"영진전문대, 일본 <b>IT</b>기업 합격자 위한 프로그램 진행",http://news.unn.net/news/articleView.html?idxno=519289,영진전문대 일본<b>IT</b>기업주문반은 지금까지 총 406명을 △소프트뱅크 △라쿠텐 △야후재팬 등 일본 <b>IT</b>분야로 진출시키며 일본 <b>IT</b>분야 <b>취업</b>에서 지속적인 성과를 내고 있다.,"Wed, 17 Nov 2021 16:02:00 +0900","영진전문대, 일본 <b>IT</b>기업 합격자 위한 프로그램 진행 영진전문대 일본<b>IT</b>기업주문반은 지금까지 총 406명을 △소프트뱅크 △라쿠텐 △야후재팬 등 일본 <b>IT</b>분야로 진출시키며 일본 <b>IT</b>분야 <b>취업</b>에서 지속적인 성과를 내고 있다."
쿠팡-육군 인사사령부 전역 장병 <b>취업</b>지원 MOU,https://www.ebn.co.kr/news/view/1508538/?sc=Naver,"박람회, <b>취업</b> 설명회 등 채용 행사에 참여해 정보통신기술 분야 인재 양성과 우수 인재 발굴에 나설 예정이다. 육군 인사사령부는 장병들에게 ICT 분야 기술 학습 환경을 조성하고 FC 운영관리직, 배송직, 안전관리직, <b>IT</b>보... ","Wed, 17 Nov 2021 15:48:00 +0900","쿠팡-육군 인사사령부 전역 장병 <b>취업</b>지원 MOU 박람회, <b>취업</b> 설명회 등 채용 행사에 참여해 정보통신기술 분야 인재 양성과 우수 인재 발굴에 나설 예정이다. 육군 인사사령부는 장병들에게 ICT 분야 기술 학습 환경을 조성하고 FC 운영관리직, 배송직, 안전관리직, <b>IT</b>보... "
"영진전문대, 일본 <b>IT</b>기업반 40명 전원 <b>취업</b> 확정",http://www.nspna.com/news/?mode=view&newsid=538489,"일본<b>IT</b>기업주문반은 내년 졸업예정자를 포함해 지금까지 총 406명을 소프트뱅크, 라쿠텐, 야후재팬 등 일본 <b>IT</b>분야로 진출시키며 일본 <b>IT</b>분야 <b>취업</b>에서 독보적인 성과를 내고 있다. 한편 영진전문대학교는 최근 2년간... ","Wed, 17 Nov 2021 15:48:00 +0900","영진전문대, 일본 <b>IT</b>기업반 40명 전원 <b>취업</b> 확정 일본<b>IT</b>기업주문반은 내년 졸업예정자를 포함해 지금까지 총 406명을 소프트뱅크, 라쿠텐, 야후재팬 등 일본 <b>IT</b>분야로 진출시키며 일본 <b>IT</b>분야 <b>취업</b>에서 독보적인 성과를 내고 있다. 한편 영진전문대학교는 최근 2년간... "
"쿠팡, 육군 인사사령부와 전역 장병 <b>취업</b>지원 MOU 체결",https://www.inthenews.co.kr/news/article.html?no=41489,"<b>취업</b>박람회, <b>취업</b>설명회 등 채용 행사에 참여할 계획입니다. 정보통신기술(ICT) 분야 인재양성과 우수 인재 발굴에도 나섭니다. 육군 인사사령부는 FC 운영관리직·배송직(쿠팡친구)·안전관리직·<b>IT</b>보안직 등 현재 쿠팡이... ","Wed, 17 Nov 2021 15:48:00 +0900","쿠팡, 육군 인사사령부와 전역 장병 <b>취업</b>지원 MOU 체결 <b>취업</b>박람회, <b>취업</b>설명회 등 채용 행사에 참여할 계획입니다. 정보통신기술(ICT) 분야 인재양성과 우수 인재 발굴에도 나섭니다. 육군 인사사령부는 FC 운영관리직·배송직(쿠팡친구)·안전관리직·<b>IT</b>보안직 등 현재 쿠팡이... "
"쿠팡, 육군 인사사령부와 전역장병 <b>취업</b>지원 MOU 체결",https://www.tfmedia.co.kr/news/article.html?no=115773,"장병들의 <b>취업</b>지원과 정보통신기술(ICT) 인재양성을 위한 업무협약을 체결했다고 17일 밝혔다. 이번... 안전관리직, <b>IT</b>보안직 등 현재 쿠팡이 모집하고 있는 채용 분야에 적합한 우수인재를 적극적으로 추천할... ","Wed, 17 Nov 2021 15:46:00 +0900","쿠팡, 육군 인사사령부와 전역장병 <b>취업</b>지원 MOU 체결 장병들의 <b>취업</b>지원과 정보통신기술(ICT) 인재양성을 위한 업무협약을 체결했다고 17일 밝혔다. 이번... 안전관리직, <b>IT</b>보안직 등 현재 쿠팡이 모집하고 있는 채용 분야에 적합한 우수인재를 적극적으로 추천할... "
"쿠팡, 육군 인사사령부와 전역 장병 <b>취업</b>지원 업무협약",https://news.naver.com/main/read.naver?mode=LSD&mid=sec&sid1=101&oid=119&aid=0002548955,"쿠팡은 육군 인사사령부와 함께 육군본부 계룡대에서 전역을 앞둔 장병들의 <b>취업</b>지원과 정보통신기술(ICT)... 안전관리직, <b>IT</b>보안직 등 현재 쿠팡이 모집하고 있는 채용 분야에 적합한 우수인재를 적극적으로 추천할... ","Wed, 17 Nov 2021 15:41:00 +0900","쿠팡, 육군 인사사령부와 전역 장병 <b>취업</b>지원 업무협약 쿠팡은 육군 인사사령부와 함께 육군본부 계룡대에서 전역을 앞둔 장병들의 <b>취업</b>지원과 정보통신기술(ICT)... 안전관리직, <b>IT</b>보안직 등 현재 쿠팡이 모집하고 있는 채용 분야에 적합한 우수인재를 적극적으로 추천할... "
쿠팡-육군 인사사령부 전역 장병 <b>취업</b>지원 MOU 체결,http://www.wsobi.com/news/articleView.html?idxno=146055,"쿠팡은 17일 육군 인사사령부와 함께 육군본부 계룡대에서 전역을 앞둔 장병들의 <b>취업</b>지원과 정보통신기술... 안전관리직, <b>IT</b>보안직 등 현재 쿠팡이 모집하고 있는 채용 분야에 적합한 우수인재를 적극적으로 추천할... ","Wed, 17 Nov 2021 15:40:00 +0900","쿠팡-육군 인사사령부 전역 장병 <b>취업</b>지원 MOU 체결 쿠팡은 17일 육군 인사사령부와 함께 육군본부 계룡대에서 전역을 앞둔 장병들의 <b>취업</b>지원과 정보통신기술... 안전관리직, <b>IT</b>보안직 등 현재 쿠팡이 모집하고 있는 채용 분야에 적합한 우수인재를 적극적으로 추천할... "
"&quot;전역 장병 <b>취업</b> 지원&quot;...쿠팡·육군 인사사령부, MOU",http://www.youthdaily.co.kr/news/article.html?no=86176,"장병들의 <b>취업</b>지원과 정보통신기술(ICT) 인재양성을 위한 업무협약을 체결했다고 17일 밝혔다. 이번 협약은... 안전관리직, <b>IT</b>보안직 등 현재 쿠팡이 모집하고 있는 채용 분야에 적합한 우수인재를 적극 추천할 예정이다.... ","Wed, 17 Nov 2021 15:38:00 +0900","&quot;전역 장병 <b>취업</b> 지원&quot;...쿠팡·육군 인사사령부, MOU 장병들의 <b>취업</b>지원과 정보통신기술(ICT) 인재양성을 위한 업무협약을 체결했다고 17일 밝혔다. 이번 협약은... 안전관리직, <b>IT</b>보안직 등 현재 쿠팡이 모집하고 있는 채용 분야에 적합한 우수인재를 적극 추천할 예정이다.... "
"부천시, 중장년일자리 박람회 개최",http://www.breaknews.com/848651,"또한, 맞춤형 <b>취업</b>상담 및 <b>취업</b>타로, 지문심리검사, 퍼스널컬러진단 등 심리검사를... In addition, <b>it</b> plans to provide employment-related counseling services for job seekers through psychological... ","Wed, 17 Nov 2021 15:36:00 +0900","부천시, 중장년일자리 박람회 개최 또한, 맞춤형 <b>취업</b>상담 및 <b>취업</b>타로, 지문심리검사, 퍼스널컬러진단 등 심리검사를... In addition, <b>it</b> plans to provide employment-related counseling services for job seekers through psychological... "
"악어디지털, 특성화고 AI 유망인재 육성 앞장선다",http://www.cctvnews.co.kr/news/articleView.html?idxno=231639,악어디지털은 특성화고등학교 출신의 <b>IT</b> 인재의 육성을 전담하는 신규 조직 '악어 캠퍼스 TF'를 신설... 이중 수원정보과학고에서는 지난 9월부터 10월까지 약 한 달여 간 <b>취업</b>맞춤반 실습 과정을 진행해 2명이... ,"Wed, 17 Nov 2021 15:34:00 +0900","악어디지털, 특성화고 AI 유망인재 육성 앞장선다 악어디지털은 특성화고등학교 출신의 <b>IT</b> 인재의 육성을 전담하는 신규 조직 '악어 캠퍼스 TF'를 신설... 이중 수원정보과학고에서는 지난 9월부터 10월까지 약 한 달여 간 <b>취업</b>맞춤반 실습 과정을 진행해 2명이... "
"프레스 노동자, 농사 교육자가 되다",https://news.naver.com/main/read.naver?mode=LSD&mid=sec&sid1=103&oid=047&aid=0002333036,대학 진학을 접고 전문 기술을 배울 생각으로 아이티(<b>IT</b>) 분야를 떠올렸다. 마침 신문에서 대학 부설 전산원(전자계산원) 수강생 모집 광고를 보고 시험을 봤다. 2년을 다니고 <b>취업</b>을 하게 되었다. 야근이 많고 고된 생활이... ,"Wed, 17 Nov 2021 15:28:00 +0900","프레스 노동자, 농사 교육자가 되다 대학 진학을 접고 전문 기술을 배울 생각으로 아이티(<b>IT</b>) 분야를 떠올렸다. 마침 신문에서 대학 부설 전산원(전자계산원) 수강생 모집 광고를 보고 시험을 봤다. 2년을 다니고 <b>취업</b>을 하게 되었다. 야근이 많고 고된 생활이... "
"쿠팡, 육군 인사사령부와 전역 장병 <b>취업</b>지원 MOU 체결",http://www.ekoreanews.co.kr/news/articleView.html?idxno=54391,"사진=쿠팡 제공  쿠팡이 육군 인사사령부와 손잡고 전역 예정 장병 <b>취업</b>지원에 적극 나선다. 쿠팡은 육군... 안전관리직, <b>IT</b>보안직 등 현재 쿠팡이 모집하고 있는 채용 분야에 적합한 우수인재를 적극적으로 추천할... ","Wed, 17 Nov 2021 15:26:00 +0900","쿠팡, 육군 인사사령부와 전역 장병 <b>취업</b>지원 MOU 체결 사진=쿠팡 제공  쿠팡이 육군 인사사령부와 손잡고 전역 예정 장병 <b>취업</b>지원에 적극 나선다. 쿠팡은 육군... 안전관리직, <b>IT</b>보안직 등 현재 쿠팡이 모집하고 있는 채용 분야에 적합한 우수인재를 적극적으로 추천할... "
"쿠팡, 육군 인사사령부와 전역장병 <b>취업</b> 지원 맞손",https://news.naver.com/main/read.naver?mode=LSD&mid=sec&sid1=101&oid=003&aid=0010838069,"안전관리직, <b>IT</b>보안직 등 채용 분야에 적합한 우수 인재를 추천할 예정이다. 이날 협약식에는 김명규 쿠팡 전무와 고태남 육군 인사사령관(소장) 등 관계자가 참석해 장병들의 <b>취업</b> 지원에 지속적으로 힘쓸 것을 약속했다.... ","Wed, 17 Nov 2021 15:12:00 +0900","쿠팡, 육군 인사사령부와 전역장병 <b>취업</b> 지원 맞손 안전관리직, <b>IT</b>보안직 등 채용 분야에 적합한 우수 인재를 추천할 예정이다. 이날 협약식에는 김명규 쿠팡 전무와 고태남 육군 인사사령관(소장) 등 관계자가 참석해 장병들의 <b>취업</b> 지원에 지속적으로 힘쓸 것을 약속했다.... "
"쿠팡, 전역 장병 채용 늘린다 ",http://www.seoulfn.com/news/articleView.html?idxno=438018,17일 충남 계룡시 신도안면 계룡대에서 전역(예정)장병 <b>취업</b> 지원 업무협약(MOU)을 한 고태남 육군 인사사령관... 정보기술(<b>IT</b>)보안직 등 현재 쿠팡이 모집하는 채용 분야에 적합한 인재를 추천할 예정이다. 고태남 육군... ,"Wed, 17 Nov 2021 15:04:00 +0900","쿠팡, 전역 장병 채용 늘린다  17일 충남 계룡시 신도안면 계룡대에서 전역(예정)장병 <b>취업</b> 지원 업무협약(MOU)을 한 고태남 육군 인사사령관... 정보기술(<b>IT</b>)보안직 등 현재 쿠팡이 모집하는 채용 분야에 적합한 인재를 추천할 예정이다. 고태남 육군... "
"쿠팡, 육군 인사사령부와 전역 장병 <b>취업</b>지원 MOU 체결",https://www.dnews.co.kr/uhtml/view.jsp?idxno=202111171453157600774,"쿠팡이 육군 인사사령부와 전역 예정 장병의 <b>취업</b>을 지원한다. 쿠팡은 육군 인사사령부와 전역을 앞둔... FC 운영관리직, 배송직(쿠팡친구), 안전관리직, <b>IT</b>보안직 등 현재 쿠팡이 모집하고 있는 채용 분야에 적합한 인재를... ","Wed, 17 Nov 2021 15:02:00 +0900","쿠팡, 육군 인사사령부와 전역 장병 <b>취업</b>지원 MOU 체결 쿠팡이 육군 인사사령부와 전역 예정 장병의 <b>취업</b>을 지원한다. 쿠팡은 육군 인사사령부와 전역을 앞둔... FC 운영관리직, 배송직(쿠팡친구), 안전관리직, <b>IT</b>보안직 등 현재 쿠팡이 모집하고 있는 채용 분야에 적합한 인재를... "
"NS홈쇼핑, 2022년 신입사원 공개채용 진행",http://www.thefirstmedia.net/news/articleView.html?idxno=84349,"채용 직무는 PD, MD, <b>IT</b>, 서비스기획, 방송심의 부문이며, 지원대상은 2022년 2월 졸업예정자 및 기... NS홈쇼핑 인사팀 박재순 팀장은 &quot;어려운 시국이지만 <b>취업</b>준비생들을 직접 만나 혼자 준비하느라 힘들었을... ","Wed, 17 Nov 2021 15:00:00 +0900","NS홈쇼핑, 2022년 신입사원 공개채용 진행 채용 직무는 PD, MD, <b>IT</b>, 서비스기획, 방송심의 부문이며, 지원대상은 2022년 2월 졸업예정자 및 기... NS홈쇼핑 인사팀 박재순 팀장은 &quot;어려운 시국이지만 <b>취업</b>준비생들을 직접 만나 혼자 준비하느라 힘들었을... "
"쿠팡, 육군 인사사령부와 장병 <b>취업</b>지원 나선다",http://www.smedaily.co.kr/news/articleView.html?idxno=218458,"사진/쿠팡 쿠팡은 육군 인사사령부와 함께 육군본부 계룡대에서 전역을 앞둔 장병들의 <b>취업</b>지원과... 안전관리직, <b>IT</b>보안직 등 현재 쿠팡이 모집하고 있는 채용 분야에 적합한 우수인재를 적극적으로... ","Wed, 17 Nov 2021 15:00:00 +0900","쿠팡, 육군 인사사령부와 장병 <b>취업</b>지원 나선다 사진/쿠팡 쿠팡은 육군 인사사령부와 함께 육군본부 계룡대에서 전역을 앞둔 장병들의 <b>취업</b>지원과... 안전관리직, <b>IT</b>보안직 등 현재 쿠팡이 모집하고 있는 채용 분야에 적합한 우수인재를 적극적으로... "
"쿠팡, 육군 인사사령부와 전역 장병 <b>취업</b>지원 MOU 체결 ",http://www.thefirstmedia.net/news/articleView.html?idxno=84381,"사진=쿠팡 쿠팡은 육군 인사사령부와 함께 육군본부 계룡대에서 전역을 앞둔 장병들의 <b>취업</b>지원과... 안전관리직, <b>IT</b>보안직 등 현재 쿠팡이 모집하고 있는 채용 분야에 적합한 우수인재를 적극적으로 추천할 예정이다.... ","Wed, 17 Nov 2021 15:00:00 +0900","쿠팡, 육군 인사사령부와 전역 장병 <b>취업</b>지원 MOU 체결  사진=쿠팡 쿠팡은 육군 인사사령부와 함께 육군본부 계룡대에서 전역을 앞둔 장병들의 <b>취업</b>지원과... 안전관리직, <b>IT</b>보안직 등 현재 쿠팡이 모집하고 있는 채용 분야에 적합한 우수인재를 적극적으로 추천할 예정이다.... "
"한국마이크로소프트, 30여개 파트너사와 온라인 잡 페어 진행",http://www.sisamagazine.co.kr/news/articleView.html?idxno=413908,이날 행사에서는 저스틴 유 한국마이크로소프트 시니어 CA(Cloud Advocate)와 김유경 링크드인 매니저가 각각 <b>IT</b>산업의 최신 트렌드와 비즈니스 네트워크 구축과 <b>취업</b>을 위한 링크드인 활용법을 선보인다. 이번 온라인 잡... ,"Wed, 17 Nov 2021 14:58:00 +0900","한국마이크로소프트, 30여개 파트너사와 온라인 잡 페어 진행 이날 행사에서는 저스틴 유 한국마이크로소프트 시니어 CA(Cloud Advocate)와 김유경 링크드인 매니저가 각각 <b>IT</b>산업의 최신 트렌드와 비즈니스 네트워크 구축과 <b>취업</b>을 위한 링크드인 활용법을 선보인다. 이번 온라인 잡... "
"쿠팡, 전역 장병 채용 확대…육군 인사사령부와 맞손",https://news.naver.com/main/read.naver?mode=LSD&mid=sec&sid1=101&oid=421&aid=0005729989,쿠팡이 육군 인사사령부와 손잡고 전역 예정 장병 <b>취업</b> 지원에 나선다. 쿠팡은 육군 인사사령부와 함께... (쿠팡친구)·안전관리직·정보통신(<b>IT</b>)보안직을 포함해 현재 쿠팡이 모집하고 있는 채용 분야에 적합한 인재를... ,"Wed, 17 Nov 2021 14:58:00 +0900","쿠팡, 전역 장병 채용 확대…육군 인사사령부와 맞손 쿠팡이 육군 인사사령부와 손잡고 전역 예정 장병 <b>취업</b> 지원에 나선다. 쿠팡은 육군 인사사령부와 함께... (쿠팡친구)·안전관리직·정보통신(<b>IT</b>)보안직을 포함해 현재 쿠팡이 모집하고 있는 채용 분야에 적합한 인재를... "
"KT&amp;G, 고용노동부와 청년 일자리 지원 맞손",http://www.thekpm.com/view.php?ud=20211117145151628942ef4e12e4_17,백복기 KT&amp;G 사장은 지난 16일 ‘청년고용 응원 프로젝트’는 고용노동부와 기업이 협업해 <b>취업</b> 역량을... 6급·원급 신입사원 모집 분야는 ▷경영관리·기획 ▷부동산 ▷정보기술(<b>IT</b>) ▷제조 ▷원료 ▷기술개발(R&amp;D)... ,"Wed, 17 Nov 2021 14:54:00 +0900","KT&amp;G, 고용노동부와 청년 일자리 지원 맞손 백복기 KT&amp;G 사장은 지난 16일 ‘청년고용 응원 프로젝트’는 고용노동부와 기업이 협업해 <b>취업</b> 역량을... 6급·원급 신입사원 모집 분야는 ▷경영관리·기획 ▷부동산 ▷정보기술(<b>IT</b>) ▷제조 ▷원료 ▷기술개발(R&amp;D)... "
