title,link,description,pubDate,title_description
"서울여대 대학일자리플러스사업단, 동문 특강 프로그램 '언니들이 돌아왔다' ...",http://www.veritas-a.com/news/articleView.html?idxno=398712,"진출과 <b>취업</b>에 실질적인 도움을 줄 수 있는 동문 특강 프로그램 '언니들이 돌아왔다'를 성공적으로 운영하고 있다고 26일 전했다. 지난 6월 '언니들이 돌아왔다' 프로그램은 <b>IT</b>컨설팅, 제약 품질관리, 공기업 행정직... ","Fri, 26 Nov 2021 16:16:00 +0900","서울여대 대학일자리플러스사업단, 동문 특강 프로그램 '언니들이 돌아왔다' ... 진출과 <b>취업</b>에 실질적인 도움을 줄 수 있는 동문 특강 프로그램 '언니들이 돌아왔다'를 성공적으로 운영하고 있다고 26일 전했다. 지난 6월 '언니들이 돌아왔다' 프로그램은 <b>IT</b>컨설팅, 제약 품질관리, 공기업 행정직... "
"메가스터디<b>IT</b>아카데미, 특성화고 진학전략 알 수 있는 '소프트웨어 설명회’ ...",https://www.thisisgame.com/webzine/game/nboard/225/?n=138118,상위권<b>IT</b>특성화고의 대표적인 학교인 선린인터넷고와 한국디지털미디어고는 매년 높은 대학 진학률 뿐만 아니라 <b>취업</b>률을 기록하고 있다. 이렇다 보니 현재 고입을 앞 둔 중학생 및 학부모의 경우 상위권<b>IT</b>특성화고... ,"Fri, 26 Nov 2021 16:02:00 +0900","메가스터디<b>IT</b>아카데미, 특성화고 진학전략 알 수 있는 '소프트웨어 설명회’ ... 상위권<b>IT</b>특성화고의 대표적인 학교인 선린인터넷고와 한국디지털미디어고는 매년 높은 대학 진학률 뿐만 아니라 <b>취업</b>률을 기록하고 있다. 이렇다 보니 현재 고입을 앞 둔 중학생 및 학부모의 경우 상위권<b>IT</b>특성화고... "
[교육소식]건양대 간호대 '졸업메달 수여·나이팅게일 선서식' 등,https://news.naver.com/main/read.naver?mode=LSD&mid=sec&sid1=102&oid=003&aid=0010856572,"간호대학은 이날 수시모집 합격생 및 학부모를 대상으로 ▲간호대학 교육·시설·<b>취업</b>사례 ▲선후배와의... 대전대는 정보보안학과 조영복 교수가 지도한 <b>IT</b>-ATCH팀(신채린년, 이재경, 김준겸, 정애리씨)이 시각장애... ","Fri, 26 Nov 2021 15:57:00 +0900","[교육소식]건양대 간호대 '졸업메달 수여·나이팅게일 선서식' 등 간호대학은 이날 수시모집 합격생 및 학부모를 대상으로 ▲간호대학 교육·시설·<b>취업</b>사례 ▲선후배와의... 대전대는 정보보안학과 조영복 교수가 지도한 <b>IT</b>-ATCH팀(신채린년, 이재경, 김준겸, 정애리씨)이 시각장애... "
"한국<b>IT</b>직업전문학교 시각디자인학과, 비실기로 2022학년도 신입생 모집",https://www.ekn.kr/web/view.php?key=20211126010004710,"아울러, 기초학기, 심화 프로젝트 학기, 멘토링 시스템 등의 교육시스템을 통해 포트폴리오 제작을 교육하고 교내 <b>취업</b>지원센터를 통해 <b>취업</b>컨설팅을 별도로 진행하고 있다. 한국<b>IT</b>직업전문학교는 웹툰학과... ","Fri, 26 Nov 2021 15:46:00 +0900","한국<b>IT</b>직업전문학교 시각디자인학과, 비실기로 2022학년도 신입생 모집 아울러, 기초학기, 심화 프로젝트 학기, 멘토링 시스템 등의 교육시스템을 통해 포트폴리오 제작을 교육하고 교내 <b>취업</b>지원센터를 통해 <b>취업</b>컨설팅을 별도로 진행하고 있다. 한국<b>IT</b>직업전문학교는 웹툰학과... "
"전국시도교육감협의회, 제81회 총회 개최",http://www.breaknews.com/851167,"고졸<b>취업</b>활성화와 직업교육의 정상화를 위하여 시도교육청 공동의 노력을... In addition, <b>it</b> was agreed that most of the authority of elementary and secondary education should be transferred... ","Fri, 26 Nov 2021 14:44:00 +0900","전국시도교육감협의회, 제81회 총회 개최 고졸<b>취업</b>활성화와 직업교육의 정상화를 위하여 시도교육청 공동의 노력을... In addition, <b>it</b> was agreed that most of the authority of elementary and secondary education should be transferred... "
대전시장애인<b>IT</b>협회 안창용 신임 회장 취임,http://www.chungnamilbo.co.kr/news/articleView.html?idxno=635114,"집단의 <b>취업</b>촉진, 소외계층의 사회통합을 위해 최선을 다하겠다&quot;고 포부를 밝혔다. 한편 이날 행사에는 안창용 사)대전시장애인<b>IT</b>협회 신임 회장과 임원들을 비롯 박상훈 사)한국장애인<b>IT</b>협회 중앙회장, 권중순... ","Fri, 26 Nov 2021 13:58:00 +0900","대전시장애인<b>IT</b>협회 안창용 신임 회장 취임 집단의 <b>취업</b>촉진, 소외계층의 사회통합을 위해 최선을 다하겠다&quot;고 포부를 밝혔다. 한편 이날 행사에는 안창용 사)대전시장애인<b>IT</b>협회 신임 회장과 임원들을 비롯 박상훈 사)한국장애인<b>IT</b>협회 중앙회장, 권중순... "
"창원문성대, 컴퓨터공학과 일본 해외<b>취업</b> 설명회 실시",http://www.gimhaenews.co.kr/news/articleView.html?idxno=44016,이후 △일본 <b>IT</b>분야 해외<b>취업</b> 준비 방법 △국내와 해외<b>취업</b> 차이점 △현지 업무 △Q&amp;A를 통해 참여자들의 해외<b>취업</b>에 대한 궁금증을 해결할 수 있는 시간을 가졌다. 창원문성대학교 대학일자리센터 관계자는 &quot;코로나19로... ,"Fri, 26 Nov 2021 13:00:00 +0900","창원문성대, 컴퓨터공학과 일본 해외<b>취업</b> 설명회 실시 이후 △일본 <b>IT</b>분야 해외<b>취업</b> 준비 방법 △국내와 해외<b>취업</b> 차이점 △현지 업무 △Q&amp;A를 통해 참여자들의 해외<b>취업</b>에 대한 궁금증을 해결할 수 있는 시간을 가졌다. 창원문성대학교 대학일자리센터 관계자는 &quot;코로나19로... "
"양주시, 2022년 장애인공공일자리 사업 참여자 모집",http://www.breaknews.com/851135,오는 30일부터 12월 6일까지 양주시는 <b>취업</b> 취약계층인 장애인의 사회참여 확대와... that <b>it</b> would recruit participants for the 2022 public job project for the disabled in order to expand... ,"Fri, 26 Nov 2021 12:52:00 +0900","양주시, 2022년 장애인공공일자리 사업 참여자 모집 오는 30일부터 12월 6일까지 양주시는 <b>취업</b> 취약계층인 장애인의 사회참여 확대와... that <b>it</b> would recruit participants for the 2022 public job project for the disabled in order to expand... "
"LG·롯데, 혁신적 '임원 인사' 단행…내달 삼성·SK·현대차도 파격 인사할까...",http://www.newswatch.kr/news/articleView.html?idxno=57229,고동진 <b>IT</b>·모바일(IM)부문 사장 등 3명을 모두 재선임하면서 2018년부터 이어진 체제 안정 쪽에 무게 중심을... 이와 함께 이번 인사에선 지난달 말 <b>취업</b>제한이 풀린 최재원 수석부회장의 복귀 여부와 업무에 가장 큰... ,"Fri, 26 Nov 2021 12:34:00 +0900","LG·롯데, 혁신적 '임원 인사' 단행…내달 삼성·SK·현대차도 파격 인사할까... 고동진 <b>IT</b>·모바일(IM)부문 사장 등 3명을 모두 재선임하면서 2018년부터 이어진 체제 안정 쪽에 무게 중심을... 이와 함께 이번 인사에선 지난달 말 <b>취업</b>제한이 풀린 최재원 수석부회장의 복귀 여부와 업무에 가장 큰... "
'안정 속 혁신' 택한 LG… 삼성-SK 인사 키워드 관심 집중,https://biz.newdaily.co.kr/site/data/html/2021/11/26/2021112600063.html,<b>IT</b>·모바일(IM)부문 사장 등 3명이 재선임된 만큼 '수뇌부' 인사는 크지 않을 것으로 예상된다. SK그룹은 최태원 SK그룹 회장의 동생 최재원 SK그룹 수석부회장의 경영 복귀 여부가 최대 관심이다. 최재원 부회장은 <b>취업</b> 제한... ,"Fri, 26 Nov 2021 12:08:00 +0900",'안정 속 혁신' 택한 LG… 삼성-SK 인사 키워드 관심 집중 <b>IT</b>·모바일(IM)부문 사장 등 3명이 재선임된 만큼 '수뇌부' 인사는 크지 않을 것으로 예상된다. SK그룹은 최태원 SK그룹 회장의 동생 최재원 SK그룹 수석부회장의 경영 복귀 여부가 최대 관심이다. 최재원 부회장은 <b>취업</b> 제한... 
[HotJobs100] 비즈니스피플이 엄선한 오늘의 경력직 채용-11월26일,https://www.businesspost.co.kr/BP?command=article_view&num=261505,"◆ 본아이에프, 정보통신(<b>IT</b>) 개발운영 담당자 채용 시스템운영 관리와 시스템개선 및 개발 업무를 수행할... 사내 <b>취업</b>과 채용 매칭 플랫폼 마케팅, 카드뉴스, 광고영상, 광고문구 등 기업과 소비자 사이 거래(B2C)... ","Fri, 26 Nov 2021 11:40:00 +0900","[HotJobs100] 비즈니스피플이 엄선한 오늘의 경력직 채용-11월26일 ◆ 본아이에프, 정보통신(<b>IT</b>) 개발운영 담당자 채용 시스템운영 관리와 시스템개선 및 개발 업무를 수행할... 사내 <b>취업</b>과 채용 매칭 플랫폼 마케팅, 카드뉴스, 광고영상, 광고문구 등 기업과 소비자 사이 거래(B2C)... "
"NH농협은행 경남본부, ESG실천기업 인증패 수상 [경남소식]",http://www.kukinews.com/newsView/kuk202111260047,"최우수상 수상 기업에는 의료교육 <b>IT</b> 서비스 창업아이템의 아이비에스티 주성주 대표가 수상했고, 우수상... 경남경영자총협회(회장 강태룡은)가 올해 청년내일채움공제에 참여한 기업과 이를 통해 <b>취업</b>을 하고... ","Fri, 26 Nov 2021 11:32:00 +0900","NH농협은행 경남본부, ESG실천기업 인증패 수상 [경남소식] 최우수상 수상 기업에는 의료교육 <b>IT</b> 서비스 창업아이템의 아이비에스티 주성주 대표가 수상했고, 우수상... 경남경영자총협회(회장 강태룡은)가 올해 청년내일채움공제에 참여한 기업과 이를 통해 <b>취업</b>을 하고... "
"외국계 기업, 대거 채용 나서",http://www.datasom.co.kr/news/articleView.html?idxno=119290,"갖춰 <b>취업</b>준비생들로부터 인기가 높다. 이 가운데, 국내에 진출한 외국계 대기업의 채용이 이어지고... 모집 부문은 ▲상품개발 ▲영업기획 ▲영업관리 ▲영업교육 ▲Digital ▲<b>IT</b> ▲Data Analytics ▲총무 ▲영업... ","Fri, 26 Nov 2021 11:30:00 +0900","외국계 기업, 대거 채용 나서 갖춰 <b>취업</b>준비생들로부터 인기가 높다. 이 가운데, 국내에 진출한 외국계 대기업의 채용이 이어지고... 모집 부문은 ▲상품개발 ▲영업기획 ▲영업관리 ▲영업교육 ▲Digital ▲<b>IT</b> ▲Data Analytics ▲총무 ▲영업... "
[Who Is ?] 김영록 전라남도 지사,https://www.businesspost.co.kr/BP?command=article_view&num=261489,김영록이 이사장으로 있는 전라남도인재육성재단은 같은 해 6월 코로나19 확산으로 <b>취업</b>준비 활동에... 스마트팜 혁신밸리는 청년인력 양성과 기술혁신 등의 기능을 집약한 정보통신기술(<b>IT</b>) 기반의 농산업... ,"Fri, 26 Nov 2021 10:26:00 +0900",[Who Is ?] 김영록 전라남도 지사 김영록이 이사장으로 있는 전라남도인재육성재단은 같은 해 6월 코로나19 확산으로 <b>취업</b>준비 활동에... 스마트팜 혁신밸리는 청년인력 양성과 기술혁신 등의 기능을 집약한 정보통신기술(<b>IT</b>) 기반의 농산업... 
‘위드 코로나’ 채용시장 미치는 영향..‘훈풍’ VS ‘부정적’,http://www.breaknews.com/851118,26일 사람인에 따르면 구직자 1084명을 대상으로 ‘위드 코로나가 <b>취업</b>에 미칠... The reason for thinking that <b>it</b> will have a positive effect on employment is that 'the industry that has been... ,"Fri, 26 Nov 2021 09:44:00 +0900",‘위드 코로나’ 채용시장 미치는 영향..‘훈풍’ VS ‘부정적’ 26일 사람인에 따르면 구직자 1084명을 대상으로 ‘위드 코로나가 <b>취업</b>에 미칠... The reason for thinking that <b>it</b> will have a positive effect on employment is that 'the industry that has been... 
"허성곤 김해시장, 지역 인재 유출 방지 '적극적'",https://news.naver.com/main/read.naver?mode=LSD&mid=sec&sid1=102&oid=002&aid=0002220638,&quot;지역서 교육받고 지역서 <b>취업</b>·창업하고 지역에 정주할 수 있는 선순환 체제 구축해야&quot; 허성곤 김해시장이... 허성곤 시장은 &quot;김해시는 미래먹거리 마련을 위해 의생명·<b>IT</b>융복합·미래자동차 등 신산업 투자를 적극... ,"Fri, 26 Nov 2021 09:43:00 +0900","허성곤 김해시장, 지역 인재 유출 방지 '적극적' &quot;지역서 교육받고 지역서 <b>취업</b>·창업하고 지역에 정주할 수 있는 선순환 체제 구축해야&quot; 허성곤 김해시장이... 허성곤 시장은 &quot;김해시는 미래먹거리 마련을 위해 의생명·<b>IT</b>융복합·미래자동차 등 신산업 투자를 적극... "
"평생학습 도시 양천구, '평생학습관 스마트창의인재센터' 개관",http://www.onews.tv/news/articleView.html?idxno=100210,"평생학습관 스마트창의인재센터는 4차 산업시대 디지털 교육을 통해 미래인재를 양성하고 <b>취업</b>·창업과... 최신 <b>IT</b> 영상기술이 적용된 가변형 미디어 공간으로 실감미디어 체험, 가상 체험 등 다양한 혼합현실을... ","Fri, 26 Nov 2021 09:22:00 +0900","평생학습 도시 양천구, '평생학습관 스마트창의인재센터' 개관 평생학습관 스마트창의인재센터는 4차 산업시대 디지털 교육을 통해 미래인재를 양성하고 <b>취업</b>·창업과... 최신 <b>IT</b> 영상기술이 적용된 가변형 미디어 공간으로 실감미디어 체험, 가상 체험 등 다양한 혼합현실을... "
"중원대, 2021년 충북지역총장협의회 11월 정기총회 개최",http://www.veritas-a.com/news/articleView.html?idxno=398576,회의에 앞서 ㈜멀티캠퍼스 김소영 상무의 '청년 <b>IT</b><b>취업</b>역량 프로그램(K-Digital Training)' 및 대학별 협력사업 활동 등을 소개한 후 지역 대학의 주요 현안을 공유하고 대학 간 상호협력과 지역사회 기여 방안 등에 대한... ,"Fri, 26 Nov 2021 08:46:00 +0900","중원대, 2021년 충북지역총장협의회 11월 정기총회 개최 회의에 앞서 ㈜멀티캠퍼스 김소영 상무의 '청년 <b>IT</b><b>취업</b>역량 프로그램(K-Digital Training)' 및 대학별 협력사업 활동 등을 소개한 후 지역 대학의 주요 현안을 공유하고 대학 간 상호협력과 지역사회 기여 방안 등에 대한... "
"세종대 대학일자리사업단, 11월 26일 SJ 동문선배 멘토링 '대기업 <b>IT</b>개발자편...",http://www.wsobi.com/news/articleView.html?idxno=146961,세종대학교(총장 배덕효) 대학일자리사업단은 11월 26일 SJ 동문선배 멘토링 '대기업 <b>IT</b>개발자편'을 개최한다. 이번 프로그램은 <b>취업</b>에 관심이 많은 학생에게 직무별 정보를 제공하기 위해 마련됐다. 멘토링은 <b>취업</b>... ,"Fri, 26 Nov 2021 08:04:00 +0900","세종대 대학일자리사업단, 11월 26일 SJ 동문선배 멘토링 '대기업 <b>IT</b>개발자편... 세종대학교(총장 배덕효) 대학일자리사업단은 11월 26일 SJ 동문선배 멘토링 '대기업 <b>IT</b>개발자편'을 개최한다. 이번 프로그램은 <b>취업</b>에 관심이 많은 학생에게 직무별 정보를 제공하기 위해 마련됐다. 멘토링은 <b>취업</b>... "
5대그룹 '인사' 막 올랐다…회장님의 선택은,https://daily.hankooki.com/lpage/industry/202111/dh20211126070009147950.htm?s_ref=nv,(CE)부문)·고동진 (<b>IT</b>모바일(IM)부문) 사장단 체제를 교체할 가능성은 낮은 것으로 관측된다. 정의선... 최태원 SK그룹 회장은 지난달 <b>취업</b>제한이 풀린 동생 최재원 수석부회장을 복귀시킬 수 있을지 재계의 관심이 크다.... ,"Fri, 26 Nov 2021 07:06:00 +0900",5대그룹 '인사' 막 올랐다…회장님의 선택은 (CE)부문)·고동진 (<b>IT</b>모바일(IM)부문) 사장단 체제를 교체할 가능성은 낮은 것으로 관측된다. 정의선... 최태원 SK그룹 회장은 지난달 <b>취업</b>제한이 풀린 동생 최재원 수석부회장을 복귀시킬 수 있을지 재계의 관심이 크다.... 
수시채용 늘리는 시중은행 ...내년 '공채 길' 더 좁아진다,https://news.naver.com/main/read.naver?mode=LSD&mid=sec&sid1=101&oid=011&aid=0003989802,지원자 입장에서는 수시채용의 일정을 예측하기 어렵고 경력자가 우대되는 만큼 <b>취업</b> 준비에 어려움이 커질... 은행들이 비단 디지털·정보기술(<b>IT</b>) 분야뿐만 아니라 은행의 전통적인 업무 분야로까지 수시 채용을... ,"Fri, 26 Nov 2021 06:46:00 +0900",수시채용 늘리는 시중은행 ...내년 '공채 길' 더 좁아진다 지원자 입장에서는 수시채용의 일정을 예측하기 어렵고 경력자가 우대되는 만큼 <b>취업</b> 준비에 어려움이 커질... 은행들이 비단 디지털·정보기술(<b>IT</b>) 분야뿐만 아니라 은행의 전통적인 업무 분야로까지 수시 채용을... 
‘인터넷뱅커 공채 문’ 케뱅이 먼저 열었다,https://news.naver.com/main/read.naver?mode=LSD&mid=sec&sid1=101&oid=011&aid=0003989799,<b>IT</b> △마케팅 △데이터 △리스크 △준법 △재무·회계 △경영지원 등 총 7개 분야다. 모집 대상은 2021년 2월 이후 4년제 대학 졸업자 혹은 2022년 8월 졸업 예정자다. 사실상의 신입 공채다. 온오프라인 금융권 대졸 <b>취업</b>... ,"Fri, 26 Nov 2021 06:31:00 +0900",‘인터넷뱅커 공채 문’ 케뱅이 먼저 열었다 <b>IT</b> △마케팅 △데이터 △리스크 △준법 △재무·회계 △경영지원 등 총 7개 분야다. 모집 대상은 2021년 2월 이후 4년제 대학 졸업자 혹은 2022년 8월 졸업 예정자다. 사실상의 신입 공채다. 온오프라인 금융권 대졸 <b>취업</b>... 
[이슈&amp;인물] 황희승 잡플래닛 대표 “메타버스로 새로운 채용 플랫폼 만들죠”,https://www.etoday.co.kr/news/view/2081419,이투데이=조성준 기자 | 2023~2024년 상장 목표 재무ㆍ구조적 준비 진행 “<b>취업</b> 시장에 퍼져 있는 다양한... 여러 <b>IT</b> 회사들이 선제적으로 메타버스로 출근을 하기 시작했다. 앞으로는 메타버스 출근이 더더욱 보편화가 되면서... ,"Fri, 26 Nov 2021 05:02:00 +0900",[이슈&amp;인물] 황희승 잡플래닛 대표 “메타버스로 새로운 채용 플랫폼 만들죠” 이투데이=조성준 기자 | 2023~2024년 상장 목표 재무ㆍ구조적 준비 진행 “<b>취업</b> 시장에 퍼져 있는 다양한... 여러 <b>IT</b> 회사들이 선제적으로 메타버스로 출근을 하기 시작했다. 앞으로는 메타버스 출근이 더더욱 보편화가 되면서... 
"[살길은융합-<b>취업</b>편②] 잡코리아 윤병준, AI 통합플랫폼으로 1위 사수",http://www.shinailbo.co.kr/news/articleView.html?idxno=1486479,윤 대표는 이러한 경험을 바탕으로 온·오프라인 현장의 중요성을 깨닫고 단순한 <b>취업</b>정보 제공업을 넘어 토털 라이프사이클 매니지먼트를 제공하는 통합 플랫폼을 강조했다. 이를 위해 잡코리아는 우수한 <b>IT</b> 인재 확보에... ,"Fri, 26 Nov 2021 05:02:00 +0900","[살길은융합-<b>취업</b>편②] 잡코리아 윤병준, AI 통합플랫폼으로 1위 사수 윤 대표는 이러한 경험을 바탕으로 온·오프라인 현장의 중요성을 깨닫고 단순한 <b>취업</b>정보 제공업을 넘어 토털 라이프사이클 매니지먼트를 제공하는 통합 플랫폼을 강조했다. 이를 위해 잡코리아는 우수한 <b>IT</b> 인재 확보에... "
오세훈 “실전형 교육으로 청년<b>취업</b> 도울 것”,https://news.naver.com/main/read.naver?mode=LSD&mid=sec&sid1=102&oid=022&aid=0003641875,영등포 청년<b>취업</b>사관학교 방문 “교육 제공·<b>취업</b>연계 사회적 책임” 2030년까지 10개 캠퍼스 계획 오세훈... “대형 <b>IT</b>(정보기술)기업이 블랙홀처럼 사람을 빨아들여서 중간 정도의 회사들은 사람이 없어서 굉장히... ,"Fri, 26 Nov 2021 03:02:00 +0900",오세훈 “실전형 교육으로 청년<b>취업</b> 도울 것” 영등포 청년<b>취업</b>사관학교 방문 “교육 제공·<b>취업</b>연계 사회적 책임” 2030년까지 10개 캠퍼스 계획 오세훈... “대형 <b>IT</b>(정보기술)기업이 블랙홀처럼 사람을 빨아들여서 중간 정도의 회사들은 사람이 없어서 굉장히... 
[MT시평]코딩역량이 국가경쟁력,https://news.naver.com/main/read.naver?mode=LSD&mid=sec&sid1=110&oid=008&aid=0004675529,"SSAFY 프로그램은 코딩, AI, 빅데이터 등 <b>IT</b>(정보기술) 분야의 실무 중심 커리큘럼으로 꾸려졌다. 단순... 본사와 <b>취업</b>도 연계한다. SK하이닉스도 반도체 분야의 역량을 강화하기 위해 인재육성 프로그램을 운영한다.... ","Fri, 26 Nov 2021 02:05:00 +0900","[MT시평]코딩역량이 국가경쟁력 SSAFY 프로그램은 코딩, AI, 빅데이터 등 <b>IT</b>(정보기술) 분야의 실무 중심 커리큘럼으로 꾸려졌다. 단순... 본사와 <b>취업</b>도 연계한다. SK하이닉스도 반도체 분야의 역량을 강화하기 위해 인재육성 프로그램을 운영한다.... "
차기 KB국민은행장 두고 허인·이동철·박정림 3파전?,https://news.naver.com/main/read.naver?mode=LSD&mid=sec&sid1=101&oid=629&aid=0000118207,"특히, 이 사장은 취임 직후부터 매년 디지털 전환을 강조해왔으며 본인도 디지털 및 <b>IT</b> 관련 지식이 해박한... 문책경고가 확정된다면 박정림 대표는 향후 3년 동안 금융권 <b>취업</b>이 제한된다. 한 금융권 관계자는... ","Fri, 26 Nov 2021 00:01:00 +0900","차기 KB국민은행장 두고 허인·이동철·박정림 3파전? 특히, 이 사장은 취임 직후부터 매년 디지털 전환을 강조해왔으며 본인도 디지털 및 <b>IT</b> 관련 지식이 해박한... 문책경고가 확정된다면 박정림 대표는 향후 3년 동안 금융권 <b>취업</b>이 제한된다. 한 금융권 관계자는... "
청년들 만난 오세훈 “문과 계통 <b>취업</b>률 떨어져…실전형 교육은 사회적 책임”,https://news.naver.com/main/read.naver?mode=LSD&mid=sec&sid1=102&oid=022&aid=0003641778,오세훈 서울시장이 25일 영등포 청년<b>취업</b>사관학교를 방문해 학생들의 의견을 듣고 있다. 서울시 제공 오세훈... “대형 <b>IT</b>(정보통신기술)기업이 블랙홀처럼 사람을 빨아들여서 중간 정도의 회사들은 사람이 없어서 굉장히... ,"Thu, 25 Nov 2021 23:02:00 +0900",청년들 만난 오세훈 “문과 계통 <b>취업</b>률 떨어져…실전형 교육은 사회적 책임” 오세훈 서울시장이 25일 영등포 청년<b>취업</b>사관학교를 방문해 학생들의 의견을 듣고 있다. 서울시 제공 오세훈... “대형 <b>IT</b>(정보통신기술)기업이 블랙홀처럼 사람을 빨아들여서 중간 정도의 회사들은 사람이 없어서 굉장히... 
"정홍술 수필가, 송파인문포럼 8대 회장에 선임",http://www.jeonmin.co.kr/news/articleView.html?idxno=343910,"나아가 주민상호 간의 갈등해소, 일자리 창출, <b>취업</b>상담, 탈북자 멘토, 청소년상담 등을 진행해 왔다. 특히, 인문학 저변 확대를 위해 최고의 강사진을 구성해 인문‧예술‧경제‧<b>IT</b>분야에 교육도 진행해 왔다. 이날 선임... ","Thu, 25 Nov 2021 21:52:00 +0900","정홍술 수필가, 송파인문포럼 8대 회장에 선임 나아가 주민상호 간의 갈등해소, 일자리 창출, <b>취업</b>상담, 탈북자 멘토, 청소년상담 등을 진행해 왔다. 특히, 인문학 저변 확대를 위해 최고의 강사진을 구성해 인문‧예술‧경제‧<b>IT</b>분야에 교육도 진행해 왔다. 이날 선임... "
청년<b>취업</b>사관학교 찾은 오세훈 &quot;실전교육으로 <b>취업</b>지원&quot;(영상),https://news.naver.com/main/read.naver?mode=LSD&mid=sec&sid1=102&oid=629&aid=0000118202,안가영 교육생은 &quot;<b>IT</b> 기업 인턴 중 새로운 목표가 생겨 청년<b>취업</b>사관학교에 들어오게 됐다&quot;며 &quot;혼자 공부할 때보다 여러 사람과 공부하며 많은 시너지를 얻을 수 있다&quot;고 만족감을 드러냈다. 김승현 교육생은 &quot;서버 개발 및... ,"Thu, 25 Nov 2021 21:29:00 +0900",청년<b>취업</b>사관학교 찾은 오세훈 &quot;실전교육으로 <b>취업</b>지원&quot;(영상) 안가영 교육생은 &quot;<b>IT</b> 기업 인턴 중 새로운 목표가 생겨 청년<b>취업</b>사관학교에 들어오게 됐다&quot;며 &quot;혼자 공부할 때보다 여러 사람과 공부하며 많은 시너지를 얻을 수 있다&quot;고 만족감을 드러냈다. 김승현 교육생은 &quot;서버 개발 및... 
