,기업명,직무,경력,학력,근무지,근무형태,분류,상세링크,기업정보
33,㈜퍼시픽링스코리아,퍼시픽링스 2022년 상반기 대규모 채용,신입·경력,학력무관,서울 강남구,정규직,"['UI·UX디자인, 골프강사, 골프장, 골프장클럽하우스, 생활체육, 스포츠, 공무, 관리, 사무행정, 시설관리, 임금관리, 자산관리, 총무, 교수설계, 교육, 교육기획, 교육훈련, 급여관리, 노무, 목표관리, 인사, 인사기획, 인사통합, 인재개발, 경리, 경영지원, 관리회계, 예산관리, 원가회계, 전산회계, 전표입력, 출납, 판매관리, 회계, 마케팅, 마케팅기획, 시장분석, 업무제휴, 가맹점영업, 국내영업, 법인영업, 일반영업, 금융영업, 보험영업, 자산관리, 가맹점관리, 거래선개발관리, 거래처관리, 고객관리, 매출관리, 영업관리, 영업기획, 법인영업, 일반영업, 고객상담, 고객응대, 고객지원, 인바운드TM, 콜센터, CS, 고객관리, 서비스홍보, 제품홍보, 홍보상담, 회원관리, 웹사이트운영, 컨텐츠개발, 컨텐츠관리, 웹퍼블리셔, CSS, CSS3, HTML5, HTML코딩, UI·UX, 모바일UI, 웹UI, 일러스트레이터, 포토샵, CSS, GUI, HTML, UI·UX디자인, 승무원, 여행사, 컨시어지, 예약·발권, 골프장, 레저, 생활체육, 스포츠, 교수설계, 교육기획, 교육진행, 교육프로그램, 동시통역, 번역, 영어, 중국어, 통역']",https://www.jobkorea.co.kr/Recruit/GI_Read/36761697?rPageCode=PL,https://www.jobkorea.co.kr/Recruit/GI_Read/36761697?rPageCode=PL
34,㈜코스니크,뷰티 쇼핑몰 온라인MD/웹디자이너/CS고객상담/물류관리 채용공고,신입·경력,학력무관,서울 강서구 외,정규직,"['사방넷, 주문관리, 택배포장, 상품기획, 소셜커머스, 쇼핑몰, 오픈마켓, 전자상거래, 홈페이지관리, 물류관리, 창고관리, 물류관리, 상품입출고, 재고관리, 물류관리, 상품기획, 상품입출고, 온라인MD, 재고관리, 창고관리, MD, AMD, 고객상담, 고객응대, 고객지원, 인바운드TM, 인터넷쇼핑몰, 콜센터, CS, 일러스트레이터, 자바스크립트, 포토샵, HTML, 그래픽디자인, 시각디자인, 일러스트레이터, 포토샵, 디지털디자인, 시각디자인, 정보디자인, 포스터디자인, 폰트디자인, 디자인기타']",https://www.jobkorea.co.kr/Recruit/GI_Read/36755812?rPageCode=PL,https://www.jobkorea.co.kr/Recruit/GI_Read/36755812?rPageCode=PL
35,㈜넷케이티아이,신입 및 경력 정규직 채용,신입·경력,고졸↑,경기 성남시 외,정규직,"['보안관리, Cisco, SI, 서버, 시스코, 클라우드, 필드, 네트웍구축, 상품기획, 신상품개발, 온라인MD, 기술영업, 신기술영업, 고객응대, CS, 네트워크엔지니어, 방화벽, 보안관리, 정보보안, Cisco, 웹프로그래머, Java, MySQL, 게시판관리, 자바스크립트, 네트워크엔지니어']",https://www.jobkorea.co.kr/Recruit/GI_Read/36731098?rPageCode=PL,https://www.jobkorea.co.kr/Recruit/GI_Read/36731098?rPageCode=PL
36,대방건설,대방건설 2022년 신입사원 공개채용,신입,대졸↑,서울,정규직,"['건설, 공무, 법무, 인허가업무, 예산관리, 마케팅, 마케팅기획, 언론홍보, 홍보, 홍보기획, 자재관리, 자재구매, 자재구매기획, 자재통합, 건설자재, 자재관리, 자재구매, 자재구매기획, 자재통합, 온라인마케팅, 공정, 공정관리, 안전, 자재관리, 품질, 품질검사, 품질관리, 품질보증, 건설, 건축, 전기설비, 건축모형, 건축설계, 건축설비설계, 조경설계, 토목설계, 건축설계, 건축시공, 실내건축, 인테리어시공, 조경디자인, 건설현장, 건축감리, 건축시공, 건축자재, 건축CM, 공무, 공사감리, 노무, 소방감리, 시공, 시공감리, 토목감리, 현장감리, 현장관리, 현장소장, 조경, 토목, 토목기사, 건설안전, 건축설비, 공조냉동, 기계설비, 산업안전, 소방설비, 시설관리, 안전, 전기공사, 전기기사, 전기배선, 전기설비, 품질관리, 소방·방재, 가스점검, 전기점검, 견적·시세, 경매입찰, 부동산, 부동산개발, 부동산시행, 분양대행, 분양상담사, 영업·홍보, 산업안전, 산업안전기사, 소방, 시설관리, 안전, 전기공사, 건설·교통']",https://www.jobkorea.co.kr/Recruit/GI_Read/36734329?rPageCode=PL,https://www.jobkorea.co.kr/Recruit/GI_Read/36734329?rPageCode=PL
37,엔아이티서비스㈜,겨울방학 특집 하반기 채용,신입·경력,학력무관,경기 성남시 외,정규직,"['IDS, 네이버, 네이버페이, 클라우드, AWS, Azure, Cloud, ddos, Docker, IPS, kubernetes, naver, Shell Script, web, WAF, 네이버 클라우드, 네이퍼 파이낸셜, 기술지원, 고객상담, 고객응대, 고객지원, 인터넷쇼핑몰, 통신업체, CS, 데이터베이스, DB2, DBA, DW, MS-SQL, MySQL, Oracle, SQL, 네트워크관리, 네트워크엔지니어, 방화벽, 보안관리, 보안관제, 보안기술, 서버관리자, 서버구축, 시스템운영, 정보보안, Linux, Windows, 모바일기획, 웹기획, 웹프로그래머, HTML, Java, jsp, mHTML, MS-SQL, MySQL, php, Python, SQL, .NET, 아이폰, 안드로이드, 액션스크립트, 응용프로그래머, 전산전공, 플래시APP, API, Application, C, C#, C#Builder, C++, C++Builder, DirectX, Embedded, Java, Linux, Oracle, Python, SAP, SQL, Unix, WAS, Windows, WindowsMobile, 가상현실, 시스템프로그래머, 어셈블리, 임베디드, 펌웨어, 쇼핑몰, 웹사이트운영, 카페·블로그관리, Helpdesk, 웹접근성, 웹퍼블리셔, 웹표준, 자바스크립트, CSS, CSS3, HTML5, HTML코딩, UI·UX']",https://www.jobkorea.co.kr/Recruit/GI_Read/36745235?rPageCode=PL,https://www.jobkorea.co.kr/Recruit/GI_Read/36745235?rPageCode=PL
38,오케이몰,(주)오케이몰 웹(PHP) 담당자 채용(주35시간 근무),경력3년↑,학력무관,서울 중구,정규직,"['상품기획, 소셜커머스, 쇼핑몰, 오픈마켓, .NET, 웹프로그래머, AJAX, ASP.NET, HDML, jsp, MS-SQL, php, Python, SQL']",https://www.jobkorea.co.kr/Recruit/GI_Read/36742928?rPageCode=PL,https://www.jobkorea.co.kr/Recruit/GI_Read/36742928?rPageCode=PL
39,오스템임플란트㈜,R&D 부문 채용,신입·경력2년↑,대졸↑,서울 강서구 외,"정규직                 외
","['UI·UX디자인, 바이오, 보건, 생명공학, 약국, 위생, 의료기기, 의약, 제약, 네트워크관리, 네트워크엔지니어, 보안관리, 보안관제, 보안기술, 서버관리자, 서버구축, 시스템운영, 정보보안, Apache, CCNA, LAN, 모바일기획, 사용자평가, 웹기획, 웹서비스기획, 웹PD, 정보설계, 제안·컨설팅, 컨텐츠기획, 통계·로그분석, UI설계, 웹프로그래머, asp, HDML, Java, jsp, MiPlatform, MS-SQL, MySQL, php, Python, 응용프로그래머, Application, C, C#, C#Builder, C++, C++Builder, Delphi, Java, Linux, Oracle, PowerBuilder, Python, SQL, VisualC++, 시스템프로그래머, 어셈블리, 임베디드, 펌웨어, HMI, MMI, 웹접근성, 웹퍼블리셔, 웹표준, 자바스크립트, CSS, CSS3, HTML5, HTML코딩, UI·UX, 모바일UI, 포토샵, HTML, UI·UX디자인, 모델링, 시스템분석, 시스템엔지니어, 요구분석, 유지보수, 펌웨어, 하드웨어, DSP, 소프트웨어, 품질검사, 품질관리, 품질보증, ISO, 제조, 테스트엔지니어, 펌웨어, 하드웨어, OrCAD, 금형설계, 기계설계, 기구설계, CAD, CAM, 정보통신·IT']",https://www.jobkorea.co.kr/Recruit/GI_Read/36747789?rPageCode=PL,https://www.jobkorea.co.kr/Recruit/GI_Read/36747789?rPageCode=PL
